tcpdump: verbose output suppressed, use -v[v]... for full protocol decode
listening on eth0, link-type EN10MB (Ethernet), snapshot length 262144 bytes
12:26:38.159291 IP 159.203.9.56.22 > 198.96.87.84.51129: Flags [P.], seq 2950195437:2950195545, ack 2251554171, win 475, length 108
12:26:38.159380 IP 159.203.9.56.22 > 198.96.87.84.51129: Flags [P.], seq 108:144, ack 1, win 475, length 36
12:26:38.159437 IP 159.203.9.56.22 > 198.96.87.84.51129: Flags [P.], seq 144:196, ack 1, win 475, length 52
12:26:38.159490 IP 159.203.9.56.22 > 198.96.87.84.51129: Flags [P.], seq 196:264, ack 1, win 475, length 68
12:26:38.159543 IP 159.203.9.56.22 > 198.96.87.84.51129: Flags [P.], seq 264:332, ack 1, win 475, length 68
12:26:38.159593 IP 159.203.9.56.22 > 198.96.87.84.51129: Flags [P.], seq 332:368, ack 1, win 475, length 36
12:26:38.161183 IP 198.96.87.84.51129 > 159.203.9.56.22: Flags [.], ack 196, win 254, length 0
12:26:38.161333 IP 198.96.87.84.51129 > 159.203.9.56.22: Flags [.], ack 368, win 253, length 0
12:26:38.177656 IP 198.96.87.84.51129 > 159.203.9.56.22: Flags [P.], seq 1:37, ack 368, win 253, length 36
12:26:38.177824 IP 159.203.9.56.22 > 198.96.87.84.51129: Flags [P.], seq 368:404, ack 37, win 475, length 36
12:26:38.208575 IP 198.96.87.84.51129 > 159.203.9.56.22: Flags [P.], seq 37:73, ack 404, win 253, length 36
12:26:38.208767 IP 159.203.9.56.22 > 198.96.87.84.51129: Flags [P.], seq 404:440, ack 73, win 475, length 36
12:26:38.239577 IP 198.96.87.84.51129 > 159.203.9.56.22: Flags [P.], seq 73:109, ack 440, win 253, length 36
12:26:38.239743 IP 159.203.9.56.22 > 198.96.87.84.51129: Flags [P.], seq 440:476, ack 109, win 475, length 36
12:26:38.259861 IP 159.203.9.56.22 > 198.96.87.84.51129: Flags [P.], seq 476:648, ack 109, win 475, length 172
12:26:38.260076 IP 159.203.9.56.22 > 198.96.87.84.51129: Flags [P.], seq 648:2084, ack 109, win 475, length 1436
12:26:38.261835 IP 198.96.87.84.51129 > 159.203.9.56.22: Flags [.], ack 648, win 252, length 0
12:26:38.261884 IP 198.96.87.84.51129 > 159.203.9.56.22: Flags [P.], seq 109:145, ack 648, win 252, length 36
12:26:38.261884 IP 198.96.87.84.51129 > 159.203.9.56.22: Flags [.], ack 2084, win 255, length 0
12:26:38.262037 IP 159.203.9.56.22 > 198.96.87.84.51129: Flags [P.], seq 2084:2120, ack 145, win 475, length 36
20 packets captured
26 packets received by filter
0 packets dropped by kernel
