tcpdump: verbose output suppressed, use -v[v]... for full protocol decode
listening on eth0, link-type EN10MB (Ethernet), snapshot length 262144 bytes
12:37:37.202055 IP 159.203.9.56.22 > 198.96.87.84.51129: Flags [P.], seq 2950254393:2950254501, ack 2251604815, win 475, length 108
12:37:37.202126 IP 159.203.9.56.22 > 198.96.87.84.51129: Flags [P.], seq 108:144, ack 1, win 475, length 36
12:37:37.202175 IP 159.203.9.56.22 > 198.96.87.84.51129: Flags [P.], seq 144:196, ack 1, win 475, length 52
12:37:37.202218 IP 159.203.9.56.22 > 198.96.87.84.51129: Flags [P.], seq 196:264, ack 1, win 475, length 68
12:37:37.202263 IP 159.203.9.56.22 > 198.96.87.84.51129: Flags [P.], seq 264:332, ack 1, win 475, length 68
12:37:37.202297 IP 159.203.9.56.22 > 198.96.87.84.51129: Flags [P.], seq 332:368, ack 1, win 475, length 36
12:37:37.203989 IP 198.96.87.84.51129 > 159.203.9.56.22: Flags [.], ack 196, win 253, length 0
12:37:37.204032 IP 198.96.87.84.51129 > 159.203.9.56.22: Flags [.], ack 332, win 253, length 0
12:37:37.218528 IP 198.96.87.84.51129 > 159.203.9.56.22: Flags [P.], seq 1:37, ack 368, win 253, length 36
12:37:37.218728 IP 159.203.9.56.22 > 198.96.87.84.51129: Flags [P.], seq 368:404, ack 37, win 475, length 36
12:37:37.254830 IP 198.96.87.84.51129 > 159.203.9.56.22: Flags [P.], seq 37:73, ack 404, win 253, length 36
12:37:37.255004 IP 159.203.9.56.22 > 198.96.87.84.51129: Flags [P.], seq 404:440, ack 73, win 475, length 36
12:37:37.280506 IP 198.96.87.84.51129 > 159.203.9.56.22: Flags [P.], seq 73:109, ack 440, win 252, length 36
12:37:37.280676 IP 159.203.9.56.22 > 198.96.87.84.51129: Flags [P.], seq 440:476, ack 109, win 475, length 36
12:37:37.299268 IP 159.203.9.56.22 > 198.96.87.84.51129: Flags [P.], seq 476:648, ack 109, win 475, length 172
12:37:37.299504 IP 159.203.9.56.22 > 198.96.87.84.51129: Flags [P.], seq 648:2076, ack 109, win 475, length 1428
12:37:37.299543 IP 159.203.9.56.22 > 198.96.87.84.51129: Flags [P.], seq 2076:2112, ack 109, win 475, length 36
12:37:37.301316 IP 198.96.87.84.51129 > 159.203.9.56.22: Flags [.], ack 2112, win 255, length 0
12:37:37.301370 IP 198.96.87.84.51129 > 159.203.9.56.22: Flags [P.], seq 109:145, ack 2112, win 255, length 36
12:37:37.301470 IP 159.203.9.56.22 > 198.96.87.84.51129: Flags [P.], seq 2112:2148, ack 145, win 475, length 36
20 packets captured
26 packets received by filter
0 packets dropped by kernel
